USERNAME,ABOUT
Oleg Kulik,"🏆 More than 18 Behance Awards🏆 Gold prize ""Ukrainian Creative Awards - The very best of"" 2021💪 5+ years in UX/UI design 💪 Head of Design Department in Art-Lemon💪 Awwwards Young Joury member 2020-2021💪 Teacher UX/UI in UX-ENERGY 💪 Third Place in 2 Hours Design Battle 2019💪 I specialize in UI&#8230; <span class='variable-text-link fake-link'> Read More</span></div><div class='variable-text variable-text-full hide'>🏆 More than 18 Behance Awards🏆 Gold prize ""Ukrainian Creative Awards - The very best of"" 2021💪 5+ years in UX/UI design 💪 Head of Design Department in Art-Lemon💪 Awwwards Young Joury member 2020-2021💪 Teacher UX/UI in UX-ENERGY 💪 Third Place in 2 Hours Design Battle 2019💪 I specialize in UI/UX Design of Custom Web and Mobile Applications✅ I approach each project individually. I'm developing only such a design that works and solves problems, not just looks beautiful. ✅ I have large experience in realization projects of different directions and degrees of complexity. Always updated with the latest technologies and trends in design. Accordingly to my hourly rate - I'm working fast and qualitatively. So, with me, you will save your time and money.✅ I'm available for all kinds of small or big projects. <span class='variable-text-link fake-link'> Read Less</span></div>"
Bananazz Agency,"🏆 More than 12 Awards💪 5 years in UX/UI design 💪 Specialize in UI/UX Design of Custom Web and Mobile ApplicationsWant to discuss your product idea or partnership? We are always ready to help 👉 bananazz.agency@gmail.comBananzZ — Design Agency from Ukraine 🇺🇦Our team consists of a group of high&#8230; <span class='variable-text-link fake-link'> Read More</span></div><div class='variable-text variable-text-full hide'>🏆 More than 12 Awards💪 5 years in UX/UI design 💪 Specialize in UI/UX Design of Custom Web and Mobile ApplicationsWant to discuss your product idea or partnership? We are always ready to help 👉 bananazz.agency@gmail.comBananzZ — Design Agency from Ukraine 🇺🇦Our team consists of a group of highly creative UX/UI, Graphic and Motion designers. We’re extremely good at everything related to design works:✅ UX/UI design (Promo Websites, E-commerce, Corporate Websites, Dashboards etc.)✅ Mobile App design✅ Logo design✅ Branding <span class='variable-text-link fake-link'> Read Less</span></div>"
MD.HASIBUL ISLAM,"👋I'm a digital product designer with over three years of experience in Website, iOS, and Android. so it’s a ensure for you that you will get a professional service from me. I'm here to help you to promote your business 24/7*365 days, including weekends as a remote consultant.Please feel free to contact me an&#8230; <span class='variable-text-link fake-link'> Read More</span></div><div class='variable-text variable-text-full hide'>👋I'm a digital product designer with over three years of experience in Website, iOS, and Android. so it’s a ensure for you that you will get a professional service from me. I'm here to help you to promote your business 24/7*365 days, including weekends as a remote consultant.Please feel free to contact me anytime !!AREAS OF EXPERTISE:• UX Research, Planning• UX & Interaction Design• Wireframing (low & high)• Prototyping• High Fidelity Design• User Interface Design• Web Design• Mobile Apps Design• Dashboard DesignCONTACT MEEmail: hasib.uxui@gmail.com <span class='variable-text-link fake-link'> Read Less</span></div>"
Anton Shmatko,"👦Hi there!My name is Anton and I have been working as a UI/UX designer for over 6 years. My huge experience and deep fundamental knowledge of design allows me to work with almost any industry. I can design a website, a mobile app, an e-commerce site, a large Saas platform, and much more from scratch.I provide&#8230; <span class='variable-text-link fake-link'> Read More</span></div><div class='variable-text variable-text-full hide'>👦Hi there!My name is Anton and I have been working as a UI/UX designer for over 6 years. My huge experience and deep fundamental knowledge of design allows me to work with almost any industry. I can design a website, a mobile app, an e-commerce site, a large Saas platform, and much more from scratch.I provide high-end and up-to-date designs using the latest tools and technology available. I know exactly, what are the opportunities and constraints of HTML/CSS/JS and I create the design easy to implement for front-end developers.🖥️I am working with :✓ Figma✓ Sketch✓ Adobe Photoshop✓ Adobe After Effects✓ Adobe XD✓ InVision✓ Zeplin💡My skills:✓ UX research✓ Wireframes✓ UI Design✓ Prototyping✓ Style Guide✓ Mobile Apps✓ Web Apps✓ Landing pages✓ Responsive design✓ UI kit💼 Industries:✓ Fintech✓ Education✓ E-commerce✓ Travel✓ Entertainment✓ Specialized Consumer Services✓ Health Care🔥 I am an open person and I always work conscientiously. If you are interested in high-quality design, I would be glad to discuss your project!E-mail: antonshmatko.designs@gmail.comSkype: headbikbathbiu <span class='variable-text-link fake-link'> Read Less</span></div>"
Tanim Khan,"🦋 Tanim Khan here. Greets! A specialist in UX/UI design.✨ A passion of mine is designing and solving problems through user experience, primarily on modern web UI. Thank you.😊💼 E-mail: client.tanim@gmail.com"
Zetafonts Type Foundry,"Zetafonts is a digital foundry founded by Francesco Canovaro, Debora Manetti and Cosimo Lorenzo Pancini. Based in Florence, Italy, it has spent more than a decade designing and releasing typefaces on the web following the Creative Commons NonCommercial philosophy.A wide range of commercial licensing options is av&#8230; <span class='variable-text-link fake-link'> Read More</span></div><div class='variable-text variable-text-full hide'>Zetafonts is a digital foundry founded by Francesco Canovaro, Debora Manetti and Cosimo Lorenzo Pancini. Based in Florence, Italy, it has spent more than a decade designing and releasing typefaces on the web following the Creative Commons NonCommercial philosophy.A wide range of commercial licensing options is available on zetafonts.com for single professionals, small agencies or corporate entities. Zetafonts also provides custom font design services to clients that need brand typography that is as aesthetically inspiring as  functional in its applications. <span class='variable-text-link fake-link'> Read Less</span></div>"
Yifan Wu,"Yifan is an award-winning illustrator based in Nanjing. She loves doing conceptual illustrations as much as aesthetic and imaginative ones. She vents her thoughts about the idiot, morbid side of the world and her nihilism through storytelling in the personal work. She loves dancing, gardening, fantasy novels and c&#8230; <span class='variable-text-link fake-link'> Read More</span></div><div class='variable-text variable-text-full hide'>Yifan is an award-winning illustrator based in Nanjing. She loves doing conceptual illustrations as much as aesthetic and imaginative ones. She vents her thoughts about the idiot, morbid side of the world and her nihilism through storytelling in the personal work. She loves dancing, gardening, fantasy novels and cats. <span class='variable-text-link fake-link'> Read Less</span></div>"
Valerio Di Mario,Write me at:dimario.valerio@gmail.com
Johon Cruze,"Wordpress Web Design & Ecommerce Expert********************************************************************************************************I'm an experienced wordpress website designer & e-commerce developer at Fiber, Upwork marketplace and have been doing websites for over 1 year now. I will design a respo&#8230; <span class='variable-text-link fake-link'> Read More</span></div><div class='variable-text variable-text-full hide'>Wordpress Web Design & Ecommerce Expert********************************************************************************************************I'm an experienced wordpress website designer & e-commerce developer at Fiber, Upwork marketplace and have been doing websites for over 1 year now. I will design a responsive, SEO friendly Wordpress website using premium design for clients who are looking to complete their branding with a professional website that will be easy for you to manage and edit in the future at no extra cost.********************************************************************************************************Get a Professional website with all the features listed below:✔ Website with an ability to add Unlimited pages or products.✔ I can add e-commerce / online shop functionality Additional 5 working days.✔ Home page with rotating/sliding banners.✔ About Us, Services, Testimonials, Portfolio or any other page of your choice.✔ I can design every extra page design on Additional 1 working day.✔ Contact us page with contact form & Google map.✔ Easy CMS system for site management.✔ Domain / hosting with company email accounts.✔ SSL Secure and optimized Website.✔ Social pages integration e.g; facebook/twitter/youtube [optional].✔ SEO plugin for Google site rankings.✔ Integrate google analytics and submit site to google Requires no additional time.✔ Newsletter Subscription [optional].✔ FREE Live chat integration [optional].✔ Free Advice on how to update the Website.✔ I can deliver all work in 1 working day. ********************************************************************************************************Why should you choose me?✔ I work with you to listen to your needs and feedback✔ Your site will be fully branded with your logo and colours✔ You'll be with me in every stage of the design progress with daily updates✔ FREE SEO plugin with every order✔ I help you move your domain to WordPress if required✔ I provide full instructions on using your new WordPress site✔ Contact form supplied with your contact page✔ jQuery sliding banners & featured content********************************************************************************************************What the Freelancer needs to start the work:- Name of pages to create.- Nature of your business.- Content for the website of each page. - Logo of your company/business.- Any colour or design preference (if you may have)- menu tab or pages names- Information of your site functionality you want to implement.- Domain Name/hosting details if available <span class='variable-text-link fake-link'> Read Less</span></div>"
muhibur rumon,"WordPress developer who loves clean, simple and beautiful code with modern design. I also enjoy programming and architecture of WordPress and solving any kind of problems is my passion. my aim is to work with honesty, safety and timely deliver."
Maksudol Hemel,"WordPress & e-commerce Developer, expert================================➤ Web Designer➤ Landing Page Design➤ Ecommerce Store Design➤ WordPress Expert➤ WordPress Ecommerce Expert➤ WordPress Web DesignerHi, I am Maksudol HemelWordPress & e-Commerce Developer Web Designer & Developer since 2019and c&#8230; <span class='variable-text-link fake-link'> Read More</span></div><div class='variable-text variable-text-full hide'>WordPress & e-commerce Developer, expert================================➤ Web Designer➤ Landing Page Design➤ Ecommerce Store Design➤ WordPress Expert➤ WordPress Ecommerce Expert➤ WordPress Web DesignerHi, I am Maksudol HemelWordPress & e-Commerce Developer Web Designer & Developer since 2019and completed over 70+ web projects of 40+ clients at various marketplaces <span class='variable-text-link fake-link'> Read Less</span></div>"
Bogdan Nikitin,"WHO I AM My name is Bogdan. I'm a UI/UX designer living in Kiev, Ukraine. I really love my work, but even more I pleased when other people appreciate my work.WHAT I DOClean, fascinating and comfortable design for people. CONTACTSEmail - artstudio.nikitin@gmail.comSkype - bogdanlifestyleIMPORTANTLife mov&#8230; <span class='variable-text-link fake-link'> Read More</span></div><div class='variable-text variable-text-full hide'>WHO I AM My name is Bogdan. I'm a UI/UX designer living in Kiev, Ukraine. I really love my work, but even more I pleased when other people appreciate my work.WHAT I DOClean, fascinating and comfortable design for people. CONTACTSEmail - artstudio.nikitin@gmail.comSkype - bogdanlifestyleIMPORTANTLife moves pretty fast. If you don't stop and look around once in a while, you could miss it. <span class='variable-text-link fake-link'> Read Less</span></div>"
Jordi Pagès,"While his work may speak from something unidentified, something other and something strange, motion graphics designer Jordi Pages is no ‘alien’ to the artistic realm.Raised in Girona, Spain, this creative steed now calls London home – if you can call it that. While his postal address may read ‘United Kingd&#8230; <span class='variable-text-link fake-link'> Read More</span></div><div class='variable-text variable-text-full hide'>While his work may speak from something unidentified, something other and something strange, motion graphics designer Jordi Pages is no ‘alien’ to the artistic realm.Raised in Girona, Spain, this creative steed now calls London home – if you can call it that. While his postal address may read ‘United Kingdom’, Pages’ work has legs that ensure his dreams never stop sprinting from country to country.Unwilling to be constrained by restrictive labels of the design industry, Jordi can only be described as an expert in the experimental – the artist specialises in creating animation, graphics and light projections from a different world.In 2010, Pages joined forces with design studio Seeper and, in less than two years, climbed collaborative constellations and projective pipe dreams to the award of 3D Motion Graphics leader, a large feat for such a small amount of time.Perhaps what makes Pages a cut above the terrestrial rest is his involvement in linguistics and languages – his role as lecturer at the University of Arts London breathes down the neck of each and every short film narrative the designer creates.It’s not often visual brilliance and daring dialogue come hand in hand.The abstract musings of Jordi begin with a pen and paper, no more. The designer believes in using the minimal, the bare, before allowing technologic interfaces in on his artistic genius.Darker, deeper and wilder than the end animation itself, Jordi Pages’ sketches give us but an insight into what his illusively creative mind might harbour.Birth, death, and alien entities, along with existentialism, all come to mind in viewing the experimenter’s best – a feeling that stays with audiences long after screenings conclude.- Sophie Lane - 2012 <span class='variable-text-link fake-link'> Read Less</span></div>"
Syed Mikhail,"What's up, people! I'm Syed Mikhail. I do Graphics Design, Photography, Illustration, Video Editing, Animation and many more. I am a Freelancer and I advertise myself under a self branding alias known as Mad Mike! I hope you enjoy viewing my gallery."
Spaceberry Studio,What we do👇👀 Usability Audit🌐 Website Design📱 Mobile App Design™️ Digital Branding🙌 Magic📩 Want to work together?📩hello@spaceberry.studio
Kirill Solar,"Web&mobile apps development, design, consulting, startups, investments, yachtingCheck our cases at https://solar-digital.com/portfolio"
Web Systems,"Web-Systems Solutions is a Web Development Company based in Khmelnytskyi, Ukraine. We're creating digital experiences and helping businesses and organizations to grow since 2009. Since that time we’ve successfully completed more than 500 projects and have grown ourselves. Today Web-Systems Solutions is an IT com&#8230; <span class='variable-text-link fake-link'> Read More</span></div><div class='variable-text variable-text-full hide'>Web-Systems Solutions is a Web Development Company based in Khmelnytskyi, Ukraine. We're creating digital experiences and helping businesses and organizations to grow since 2009. Since that time we’ve successfully completed more than 500 projects and have grown ourselves. Today Web-Systems Solutions is an IT company with more than 80 talented developers, managers and marketers who specialize in E-Commerce, web and mobile development. But what is even more important, we’re a team that is very close-knit and able to find a creative solution to any problem together. Now we’re looking for more talents to join us as well as for more new projects to put our creative ideas into action. Let’s work together! Let’s bring ideas to life!What we do- UI/UX Design- Website development- CRM-systems for businesses- API development- CMS developmentHow we doDesign- Invision- Photoshop- Sketch- Illustrator- FigmaFront-end- React.jsBack-End- PHP- Symfony- LaravelCMS- WordPress- WooCommerce- OpenCart- Shopify <span class='variable-text-link fake-link'> Read Less</span></div>"
Vyacheslav Bardakov,Web-дизайнер (UX/UI design)
Alya Prigotska,Web UI/UX Design  |  Graphic Design  |  Logos & Branding  |  Illustration
Yulia Hetman,Web DesignerFreelancer
Lukas Majzlan,"Web Designer, UI Designer, Art Director, Apple Enthusiast & Art4web agency Founder."
WordPress Expert,"Web Designer since 2009, WordPress user, designers, and developer. "
Emi Rustamovna,Web DesignApp DesignUI/UXPrototypingGraphic designBranding
Rashed Mamun,Web Banner Expert | Social Media Banner Designer
Anastasiia Khristoforova,Web & Mobile Design Mail: k_anastasiya_k@mail.ru
Alexander Chakhutin,Web & Mobile Design Mail: Achakhutin@gmail.comTelegram: @achakhutin
Kommigraphics .,"We’re Kommigraphics, an independent visual communication agency, creating custom web design, brand identities, packaging design with immersive print & digital experiences for brands across different markets and around the globe.We have a varied project portfolio that includes branding, packaging, website desig&#8230; <span class='variable-text-link fake-link'> Read More</span></div><div class='variable-text variable-text-full hide'>We’re Kommigraphics, an independent visual communication agency, creating custom web design, brand identities, packaging design with immersive print & digital experiences for brands across different markets and around the globe.We have a varied project portfolio that includes branding, packaging, website design and implementation as well as online & offline marketing services. We see all projects in a holistic way, so that we deliver effective, worthy and memorable results that stand out. <span class='variable-text-link fake-link'> Read Less</span></div>"
PUPILA ℗,"We’re an unconventional design studio and creative consultancy based in Costa Rica.We focus on visual cheeky and insightful branding, packaging, as well as memorable experiences."
TemplateZuu Designers,We’re always-on with the ability to do presentation and website services. Please send us  a message and we will keep in touch shortly.
DesignBoat UX/UI School,"We're a design school that teaches UX and UI along with placements for designers. Our goal is to help students by mentoring, training them for their future endeavours in the respective fields and providing jobs."
Plus X,We plus experience for your brand. Plus X is brand experience marketing & design partner.
一 亻一 半  kongsi,We kongsi ideas ;We share different perspectives and aestheticsWe kongsi tangan ; We get our hands dirty in conceptual and experimental processesWe kongsi watak ; We own a personality that is both quirky and dreamyWe kongsi dream ;We are two halves that make a whole
Alphamark .,We help companies to clarify their visual communication and evolve their brand.
Ludlow Kingsley,"We first opened our doors in 2007 on the heels of an award-winning website design and development collaboration by our founding partners, Roxanne and Clark. For the first few years, Ludlow Kingsley served as a creative digital design team for large ad agencies, while persistently amassing a strong portfolio and cl&#8230; <span class='variable-text-link fake-link'> Read More</span></div><div class='variable-text variable-text-full hide'>We first opened our doors in 2007 on the heels of an award-winning website design and development collaboration by our founding partners, Roxanne and Clark. For the first few years, Ludlow Kingsley served as a creative digital design team for large ad agencies, while persistently amassing a strong portfolio and client base.Over the years, we have grown to become a harmonious team of six, configured to design, develop and deliver extraordinary work. Feathers in our cap include creating the brand identity for Parachute Home, and the rebrand of Downtown LA’s famed Grand Central Market. <span class='variable-text-link fake-link'> Read Less</span></div>"
Querida .,"We develop content strategies and creative direction for institutions, brands and individuals for both print and online projects. Based in Barcelona working worldwide. Among the services offered are branding, websites and digital environments, editorial design, photography, films and naming.We also publish Perdi&#8230; <span class='variable-text-link fake-link'> Read More</span></div><div class='variable-text variable-text-full hide'>We develop content strategies and creative direction for institutions, brands and individuals for both print and online projects. Based in Barcelona working worldwide. Among the services offered are branding, websites and digital environments, editorial design, photography, films and naming.We also publish Perdiz, a collectable magazine-object about people and the things that make them happy. The magazine is designed, edited and produced from within Querida.Perdiz is available internationally in more than 20 countries. Our stockists are contemporary art museums like the MoMA PS1 in NY or the Tate Modern in London, bookshops and newstands specialized in magazines and boutique stores all around the world. International distribution by Central Books & Pine Apple Media. <span class='variable-text-link fake-link'> Read Less</span></div>"
STUDIO RESPEKT,"We design forms that carry information. We create a reality in which there is no randomness. Unconventional and specific. This is who we are and this is how we design.We deal with wide range of visual communication. Simplicity and clear message is our main goal.Graphic identifications, social campaigns, print &#8230; <span class='variable-text-link fake-link'> Read More</span></div><div class='variable-text variable-text-full hide'>We design forms that carry information. We create a reality in which there is no randomness. Unconventional and specific. This is who we are and this is how we design.We deal with wide range of visual communication. Simplicity and clear message is our main goal.Graphic identifications, social campaigns, print and digital space are our fields of activity.Feel free to contact us. <span class='variable-text-link fake-link'> Read Less</span></div>"
Asylab,We create professional and unique products. Branding and Devices Mockups.Access to all our products for only $84/year at:https://www.asylab.comGet in touch - asylabmail@gmail.com
Duotone. io,We create new values by designing new perspective on creatives into current.We work with people to create meaningful value with creative design and well-ordered structure. Our work is designed by the value we create rather than current.We are Duotone.
Baianat Interaction,We create humanized experiences that carry really values across cultures and nations. Our aim is to contribute to a better world by making solutions that incorporate good UX and cutting edge technology.Contact usEmail: hello@baianat.comWhatsApp and calls: 00201000111888
Feel This,"We create high-quality digital products with love. You can find social media templates, mockups, scene creators, logos, and backgrounds in our shop. Products are available for purchase in our shop on Creative Market now.Link: creativemarket.com/feelthis"
creative digital production,"We create digital space for companies and brands. We carry out a comprehensive analysis of all components of the brand, taking into account the marketing goals and objectives of the company. The final project is often the platform and the starting point for further communication."
Stubbs Pro,"We create a highly competitive product using advanced web development and design technologies. As a result, you get a fast-loading, user-friendly and attractive website with a high conversion.Our team specialises on developing web projects for medium size business & startups. We create sophisticated, secured, fa&#8230; <span class='variable-text-link fake-link'> Read More</span></div><div class='variable-text variable-text-full hide'>We create a highly competitive product using advanced web development and design technologies. As a result, you get a fast-loading, user-friendly and attractive website with a high conversion.Our team specialises on developing web projects for medium size business & startups. We create sophisticated, secured, fast-loading, high-traffic web & mobile apps. Technical approach to the creative process of designing. <span class='variable-text-link fake-link'> Read Less</span></div>"
Fireart Studio,We create a beautiful design with passion for startups & leading brandsInquiries - client@fireart.studio
UXI COMPANY,"We are engaged in business packaging and develop sales tools in the format of conversion and corporate sites, quizzes, marketplaces.Over the entire journey, we managed to learn from the experience of promoting clients from Singapore, the USA (Boston), Turkey and the CIS countries."
