USERNAME,ABOUT
Justin Golt,"Justin Golt is a diverse design professional with 9+ years of experience. Justin brings world-class skills across experience design, creative strategy and visual design together to produce results that engage, enable and educate across print, digital and space. He believes in innovation without impeding business g&#8230; <span class='variable-text-link fake-link'> Read More</span></div><div class='variable-text variable-text-full hide'>Justin Golt is a diverse design professional with 9+ years of experience. Justin brings world-class skills across experience design, creative strategy and visual design together to produce results that engage, enable and educate across print, digital and space. He believes in innovation without impeding business goals.Justin loves the design process, the collaboration and the tenacity it takes to make something truly exceptional. His design aesthetic is not cookie cutter and he is always looking to pioneer an unconventional approach. Justin builds and elevates brands through artistic insight and the power of storytelling that set standards for others to follow.Years of experience influences his approach and strategy guides it. Justin is motivated to expand horizons and create experiences people love through collaboration and leadership. Justin embraces every challenge and is always eager to learn more, do more and continually improve upon past successes.His portfolio showcases a range of well-crafted campaigns for national and international brands. Past clients have included Canon, Maxim, Honda, Strayer University and many more. <span class='variable-text-link fake-link'> Read Less</span></div>"
Nataliia Cherednychenko,Junior UI/UX designer
jubair uthsob,"Jubair Uthsob Knows first-hand the overwhelm and frustration of creating a website.For the past five years, he has created some fantastic minimalistic modern Eye-catchy websites for his clients to beat their competitors. Jubair Uthsob graduated from Northwestern University in Khulna with a degree in Computer S&#8230; <span class='variable-text-link fake-link'> Read More</span></div><div class='variable-text variable-text-full hide'>Jubair Uthsob Knows first-hand the overwhelm and frustration of creating a website.For the past five years, he has created some fantastic minimalistic modern Eye-catchy websites for his clients to beat their competitors. Jubair Uthsob graduated from Northwestern University in Khulna with a degree in Computer Science and Engineering.Jubair Uthsob has his own company where he works with his clients, helping them build a perfect website that can boost their business.He is most active on her Facebook profile, where he publishes his completedprojects.He can also build a website from scratch using CSS,HTML, javascript,laravel, PHP.As a freelancer Completed 215+ Projects of 25 country's 82 client's at various marketplaces since 2016.Former Top Rated Web Developer & Lead expert @ Upwork (Level-2 seller) Fiverr, People Per Hour.Trained 50+ freelancers & They earned from various marketplaces.Write continuously great freelancing/fiverr/upwork /web /wordpress/ lead blogs for Expertise / Skill Sets.Jubair Uthsob Expert in:---------------------------------------WordPress & WooCommerce ECommerce & ShopifyBootstrap coded responsive PSD to HTML/BootstrapCustom Javascript designed custom pluginJquery Plugin integrationWiX & SquareSpacePSD TO HTML/ HTML TO WordPressHTML, CSS. BOOTSTRAP, JAVASCRIPT, JQUERY, WordPress Bug/ Error Fixing.Digital Marketing & Social Media Marketer(SMM)Google ads, Facebook ads, ecommerce marketing & Search Engine Marketing(SEM)Search Engine Optimisation (SEO), On page SEO & Off page SEO Affiliate Marketer & Amazon Affiliate ECommerce & Dropshipping  Website Maintenance & Website Optimization Website speed increase & SEO Virtual Assistant/ Web Researcher/ Data Entry Contact Me---------------------Email: jubairuthsob5@gmail.comPhone: 01747883217 (What's app)Website: www.JubairUthsob.comFacebook: https://www.facebook.com/Jubair-Uthsob-103334468906306 <span class='variable-text-link fake-link'> Read Less</span></div>"
javier guaschetti,JAVIER GUASCHETTIHead of Art & Graphic designerFreelancePresidencia de la NaciónR/GADonCraveroLanisMcCann PyBrandforcePieriniPartnersAlegora MxBridgerConwayPuntoDGroup
Forhan Foysal,"Intro & Achievements---------------------☛ I am Forhan Foysal. Web, WordPress & WooCommerce/Landing page /Wix/ SquareSpace Developer / Dropship & eCommerce Expert.☛ As freelancer Completed 50+ Projects at various marketplaces since 2018  Expertise::: =========Skill Set (Web & WordPress/ Front & Backend E&#8230; <span class='variable-text-link fake-link'> Read More</span></div><div class='variable-text variable-text-full hide'>Intro & Achievements---------------------☛ I am Forhan Foysal. Web, WordPress & WooCommerce/Landing page /Wix/ SquareSpace Developer / Dropship & eCommerce Expert.☛ As freelancer Completed 50+ Projects at various marketplaces since 2018  Expertise::: =========Skill Set (Web & WordPress/ Front & Backend Expertise)====================================== ☛ Custom Web/ Software using Laravel Framework   ☛ WordPress theme development & customization ☛ WordPress plugin development & customization ☛ Personal/Business Website using wordpress ☛ Bootstrap coded responsive PSD to HTML/Bootstrap ☛ Custom Javascript designed custom plugin  ☛ Jquery Plugin integration  ☛ Landing Page/ Lead pages ☛  App & Games launching/ Product-Service based Landing page.☛ PSD TO HTML/ HTML TO WordPress✎ Mailer Lite/Mailchimp/ Aweber/ Get Response Email Template/Campaign☛ HTML, CSS. BOOTSTRAP, JAVASCRIPT, JQUERY, WordPress Bug/ Error Fixing.✎  Login Registration Form, Sign in- SignUp Page Creation.☛ Contact US Form/ Social Button & social sharing, Auto Responder/ facebook pixel.✎ Maintain your site for 6 months, follow up malware, speed & content edit issues.☛ jQuery plugin integration(Accordion, wow-js, owl-carousel2, wow-slider)☛ Single or multi Page HTML website✎ Create a Responsive business website using Bootstrap grid system ☛ eCommerce/woocommerce Website ☛ Website speed increase & SEO☛  Page Builder - visual composer, elementor, divi, thrive, ux builder  ☛ Payment gateway - Paypal & Stripe Integration & FB Pixel ☛ Sign up, Member & Social Sharing Features  ☛ Zoominfo Pro & Email Finding ☛ Lead Generation/ Virtual Assistant/ Web Researcher/ Data Entry Expert ☛ Signup & Pop Up Form  ☛ Mailchimp - Zaiper & Zoho Automation ☛ Mailchimp - Subscriber pop up & automation & woo automation ☛ By Mailchimp - order notify mail/ invoice/ refind/ abandoned cart mail/ product target template ☛ Get Response & Aweber ☛ Web & WordPress Expertise to Create any web sites and web applications ☛ Shopify Store design & Premium Theme Customisation ☛ Shopify Product upload & customise / Domain Transfer(Shopify to domain) ☛ Shopify & Aliexpress Dropship & Import product by Oberlo app ☛ Shopify Sales Channel & Apps Customize ☛ Shopify SEO & Speed Up & Backup-Migration ☛ Click Bank Affiliate Marketing ☛ Click Funnels/ Upsell / Lead collect/ sales funnels product/service marketing Expertise On eCommerce & WooCommerce & Shopify==============================================➤ Ecommerce Website create ➤ Woocommerce Customization➤ Shopify Store Ctration➤ Product Upload/ Category/ Pricing/ Listing➤ Product mixing/ variations & attributes➤ Product Stock Management➤ Facebook For Woocommerce ➤ Payment gateway integration(Paypal/ stripe/ Mastercard)➤ Mailchimp Woocommerce Automation➤ Check Out Form / Billing Form / Sign up Form➤ Order Notification / Order Invoice Email➤ Product retargeting email template➤ Popup form for subscriber and collect to mailchimp list➤ product page design variations stock management➤ Product image magnifier,  zoom product and coupon➤ Product management and Stock management➤ Countdown timer for sales➤ Offer and sales for promotion ➤ Location based shipping and payment➤ wishlist and compare & add to cart➤ YITH - all premium plugins➤ Google search engine for each of the product keyword➤ Best client finding and offer him best➤ loyal clients finding/  most spending line pending and send offer➤ product attributes and variation table <span class='variable-text-link fake-link'> Read Less</span></div>"
Alamin Shikder,"Intro & Achievements---------------------☛ Hi! I am a professional WordPress and eCommerce developer working for the last 3 years. I have a lot of experience in developing any WordPress and eCommerce related sites. I can make any types of form using WordPress, MailChimp integration, addFacebook pixel in any sit&#8230; <span class='variable-text-link fake-link'> Read More</span></div><div class='variable-text variable-text-full hide'>Intro & Achievements---------------------☛ Hi! I am a professional WordPress and eCommerce developer working for the last 3 years. I have a lot of experience in developing any WordPress and eCommerce related sites. I can make any types of form using WordPress, MailChimp integration, addFacebook pixel in any sites with fully responsive.☛ As freelancer Completed 80+ Projects of 40+ country's 35+ client's at various marketplaces since 2017☛ Service :-------------I will Provide you awesome service from my experience.I will Revise your project unlimited ,until you feel happy on your project. I feel so enjoy when i make a awesome website. Also I believe in a work , quality not quantity.My Skills :-----------☛ WordPress & WooCommerce Expert.☛ ECommerce Expert.☛ Elementor Expert.☛ Search Engine Optimisation (SEO), On page SEO & Off page SEO Expert.☛ Dropshipping Expert.☛ Website Maintenance & Website Optimization.☛ Website speed increase & SEO.☛ Data Entry Expert.Contact Me---------------------☛ email: mithushikder2@gmail.com☛ Phone: 01839866886 (Whats app)☛ Website: https://alaminshikder.com/ <span class='variable-text-link fake-link'> Read Less</span></div>"
MRN Shakib,"Intro & Achievements ==============Hello, I am mrnshakib. I'm a web developer living in Chittagong, Bangladesh. I am a fan of web development, web design and Lead Generator.I am extremely Passionate about accepting challenges in the Marketing world. I have been providing services for a long time on the Websit&#8230; <span class='variable-text-link fake-link'> Read More</span></div><div class='variable-text variable-text-full hide'>Intro & Achievements ==============Hello, I am mrnshakib. I'm a web developer living in Chittagong, Bangladesh. I am a fan of web development, web design and Lead Generator.I am extremely Passionate about accepting challenges in the Marketing world. I have been providing services for a long time on the Website development sector particularly in YouTube Marketing, Link Building, Classified Ads Posting and so on for E-commerce and Dropshipping Business. Moreover, I am an expert on Website with Elementor and Shopify Store creation with Dropshipping product research. I am able to work with full responsibility. My paramount priority is to satisfy my clients with quality work & friendly customer support. website www.mrnshakib.comThanks Expertise: ======Skill Set (Web & WordPress/ Front & Backend Expertise)============================== ☛ Custom Web/ Software using Laravel Framework   ☛ WordPress theme development & customization ☛ WordPress plugin development & customization ☛ Personal/Business Website using wordpress ☛ Bootstrap coded responsive PSD to HTML/Bootstrap ☛ Custom Javascript designed custom plugin  ☛ Jquery Plugin integration  ☛ Landing Page/ Lead pages ✎ Mailer Lite/Mailchimp/ Aweber/ Get Response Email Template/Campaign✎  Login Registration Form, Sign in- SignUp Page Creation.☛ Contact US Form/ Social Button & social sharing, Auto Responder/ facebook pixel.✎ Maintain your site for 6 months, follow up malware, speed & content edit issues.✎ Create a Responsive business website using Bootstrap grid system ☛ eCommerce/woocommerce Website ☛ Website speed increase & SEO ☛ Payment gateway - Paypal & Stripe Integration & FB Pixel ☛ Sign up, Member & Social Sharing Features  ☛ Zoominfo Pro & Email Finding ☛ Lead Generation/ Virtual Assistant/ Web Researcher/ Data Entry Expert ☛ Signup & Pop Up Form  ☛ Mailchimp - Zaiper & Zoho Automation ☛ Mailchimp - Subscriber pop up & automation & woo automation ☛ By Mailchimp - order notify mail/ invoice/ refind/ abandoned cart mail/ product target template ☛ Get Response & Aweber ☛ Web & WordPress Expertise to Create any web sites and web applications ☛ Shopify Store design & Premium Theme Customisation ☛ Shopify Product upload & customise / Domain Transfer(Shopify to domain) ☛ Shopify & Aliexpress Dropship & Import product by Oberlo app ☛ Shopify Sales Channel & Apps Customize ☛ Shopify SEO & Speed Up & Backup-Migration ☛ Click Bank Affiliate Marketing ☛ Click Funnels/ Upsell / Lead collect/ sales funnels product/service marketing thanks MRN ShakibExpertise On eCommerce & WooCommerce & Shopify=================================➤ Ecommerce Website create ➤ Woocommerce Customization➤ Shopify Store Ctration➤ Product Upload/ Category/ Pricing/ Listing➤ Product mixing/ variations & attributes➤ Product Stock Management➤ Facebook For Woocommerce ➤ Payment gateway integration(Paypal/ stripe/ Mastercard)➤ Mailchimp Woocommerce Automation➤ Check Out Form / Billing Form / Sign up Form➤ Order Notification / Order Invoice Email➤ Product retargeting email template➤ Popup form for subscriber and collect to mailchimp list➤ product page design variations stock management➤ Product image magnifier,  zoom product and coupon➤ Product management and Stock management➤ Countdown timer for sales➤ Offer and sales for promotion ➤ Location based shipping and payment➤ wishlist and compare & add to cart➤ YITH - all premium plugins➤ Google search engine for each of the product keyword➤ Best client finding and offer him best➤ loyal clients finding/  most spending line pending and send offer➤ product attributes and variation tableThanks MRN ShakibWEB & EMAIL MARKETING TOGETHER EXPERTISE=============================➤ Pixel Your Site for product cart/ checkout➤ Yoast SEO Premium for google seo/ webmaster➤ Abandoned cart email from mailchimp➤ Google pagespeed 80%(gTmetrix)➤ brute force attack &  attempt login block➤ hacking protection and malware blocker➤ step verification and password protection with Google recaptcha➤ Google tag manager and Google Analytics for eCommerce➤ Speed Increase eCommerce website ThanksMRN ShakibExpert Lead Generator | Business Emails & Phone Finder | MailChimp Marketing ================================✎ Collecting direct phone number using zoominfo Pro using ZIP /city/ industry✎ Lead generation, Tools:  zoominfo Pro, egrabber.com, leadmine.net, getprospect.io, eToggler, Atomic hunter, Lead Grabber, hunter.io, scrapp.io✎ Collecting email from linkedin profile (“Lead Gibbon”  & “Linkedin Sales Navigator” & “Rapportive” ext)✎ Collecting company address, location, employee size, revenue info  using compstack and buzzfile, salesfores data CRM✎ Get leads from linkedin profile using “Lead Gibbon”  & “Linkedin Sales Navigator” & “Rapportive” ✎ Verifying email I use “rapportive extension”. as well as ii use mailtester.com and “Atomic Verifier”✎ Give you personal email (gmail/yahoo) & direct phone number - by “Rocket Reach” Tools  ✎  Collect data/leads from directories : like manta, compstak and buzzfile, yellowpages, whitepages, yelp database.✎  Find instant unlimited bulk leads by - atomic email hunter/ atomic lead extractor ✎  Send unlimited email templated by : “Atomic email sender”✎  Verify instant unlimited email address & clear bounced email by: “atomic email verifier & never bounce”✎ I have nice web extracting tools, which is Web Content ExtractorThank youMRN Shakib <span class='variable-text-link fake-link'> Read Less</span></div>"
Binta Nur Risha,"Intro & Achievements ==================Hi there, I am Binta Nur Risha. Professional Website Designer and WordPress Developer with over two years of experience. I can create any kind of professional WordPress website, SEO-Friendly, Responsive, PSD to WordPress, and User-Friendly Website. I'm dedicated to your pro&#8230; <span class='variable-text-link fake-link'> Read More</span></div><div class='variable-text variable-text-full hide'>Intro & Achievements ==================Hi there, I am Binta Nur Risha. Professional Website Designer and WordPress Developer with over two years of experience. I can create any kind of professional WordPress website, SEO-Friendly, Responsive, PSD to WordPress, and User-Friendly Website. I'm dedicated to your project, ensure 100% satisfaction & hard worker. I have a positive attitude. I will work for you on flexible hours. Feel free to contact me with any queries you may have. I am here to help you. Have a nice day!Thanks  Expertise::: =========Skill Set (Web & WordPress/ Front & Backend Expertise)====================================== ☛ Custom Web/ Software using Laravel Framework   ☛ WordPress theme development & customization ☛ WordPress plugin development & customization ☛ Personal/Business Website using wordpress ☛ Bootstrap coded responsive PSD to HTML/Bootstrap ☛ Custom Javascript designed custom plugin  ☛ Jquery Plugin integration  ☛ Landing Page/ Lead pages ☛  App & Games launching/ Product-Service based Landing page.☛ PSD TO HTML/ HTML TO WordPress✎ Mailer Lite/Mailchimp/ Aweber/ Get Response Email Template/Campaign☛ HTML, CSS. BOOTSTRAP, JAVASCRIPT, JQUERY, WordPress Bug/ Error Fixing.✎  Login Registration Form, Sign in- SignUp Page Creation.☛ Contact US Form/ Social Button & social sharing, Auto Responder/ facebook pixel.✎ Maintain your site for 6 months, follow up malware, speed & content edit issues.☛ jQuery plugin integration(Accordion, wow-js, owl-carousel2, wow-slider)☛ Single or multi Page HTML website✎ Create a Responsive business website using Bootstrap grid system ☛ eCommerce/woocommerce Website ☛ Website speed increase & SEO☛  Page Builder - visual composer, elementor, divi, thrive, ux builder  ☛ Payment gateway - Paypal & Stripe Integration & FB Pixel ☛ Sign up, Member & Social Sharing Features ☛ Signup & Pop Up Form ☛ Mailchimp - Subscriber pop up & automation & woo automation ☛ By Mailchimp - order notify mail/ invoice/ refind/ abandoned cart mail/ product target template ☛ Web & WordPress Expertise to Create any web sites and web applicationsExpertise On eCommerce & WooCommerce ==============================================➤ Ecommerce Website create ➤ Woocommerce Customization➤ Product Upload/ Category/ Pricing/ Listing➤ Product mixing/ variations & attributes➤ Product Stock Management➤ Facebook For Woocommerce ➤ Payment gateway integration(Paypal/ stripe/ Mastercard)➤ Mailchimp Woocommerce Automation➤ Check Out Form / Billing Form / Sign up Form➤ Order Notification / Order Invoice Email➤ Product retargeting email template➤ Popup form for subscriber and collect to mailchimp list➤ product page design variations stock management➤ Product image magnifier,  zoom product and coupon➤ Product management and Stock management➤ Countdown timer for sales➤ Offer and sales for promotion ➤ Location based shipping and payment➤ wishlist and compare & add to cart➤ YITH - all premium plugins➤ Google search engine for each of the product keyword➤ Best client finding and offer him best➤ loyal clients finding/  most spending line pending and send offer➤ product attributes and variation table <span class='variable-text-link fake-link'> Read Less</span></div>"
