USERNAME,ABOUT
Ciano Design,"Hello! I am Ciano Design, a design studio created in 2016, and my main focus is the creation of exclusive and unique brands for my clients.The studio is located in Juiz de Fora / MG - Brazil, but since our creation we have served clients to different cities and countries in the world.My main objective is to he&#8230; <span class='variable-text-link fake-link'> Read More</span></div><div class='variable-text variable-text-full hide'>Hello! I am Ciano Design, a design studio created in 2016, and my main focus is the creation of exclusive and unique brands for my clients.The studio is located in Juiz de Fora / MG - Brazil, but since our creation we have served clients to different cities and countries in the world.My main objective is to help people and companies to enhance their brands through visual identity projects that really communicate with the target audience, facilitating the relationship between brand and consumer. <span class='variable-text-link fake-link'> Read Less</span></div>"
Marina Tyshchuk,Hello! I am a Kyiv-based digital product designer. Let's put some pixels together. 🌍 Available worldwide 👩🏻‍🎨 Open for freelance or part-time projectsServices:✔️ Website design✔️ App design✔️ UX/UI design✔️ Presentations
Kate Distry,"Hello,My name is Kate Distry. I'm a Lead UX/UI Designer.Minimal/Graphic style.If you have any project feel free to say hello:sinyazh@gmail.com"
Anthony Lam,"Hello, this is Anthony Lam, a multidisciplinary designer specializing in visual Identity, branding, illustration and editorial design."
Shanto Islam,"Hello, My Self Shanto Islam.Highly motivated & goal-oriented individual seeking to further my knowledge & experience in any way, shape, or form possible. I'm an avid learner quick on my feet & calm under pressure. I'm exceedingly patient & inventive & look for any opportunities available to enhance my Character. &#8230; <span class='variable-text-link fake-link'> Read More</span></div><div class='variable-text variable-text-full hide'>Hello, My Self Shanto Islam.Highly motivated & goal-oriented individual seeking to further my knowledge & experience in any way, shape, or form possible. I'm an avid learner quick on my feet & calm under pressure. I'm exceedingly patient & inventive & look for any opportunities available to enhance my Character. I'm very Professional as a Front End WordPress Web Developer & Graphic Designer. With more than 5 yrs of true experience. Can quickly produce quality work to fulfill any need. Hard-working and communicative. Very passionate love my work!Best/Shanto Islam <span class='variable-text-link fake-link'> Read Less</span></div>"
Thanh Huyền,"Hello, my name is Thanh Huyen, I come from Vietnam. I am a Graphic designer and UIUX designer.Looking forward to connecting with you!"
Thanh Huyền,"Hello, my name is Thanh Huyen, I come from Vietnam. I am a Graphic designer and UIUX designer.Looking forward to connecting with you!"
Pavel Talpa,"Hello, my name is Pavel.I develop websites on Tilda. In design, I love creativity and mixing styles.To discuss your project, please contact me.Email: pavel.talpa.y@gmail.com"
Mukhammad Nurullaev,"Hello, my name is Mukhammad and i am digital designer based in Russia.I'm always open for collaboration and new projectsE-mail: spacelive.company@gmail.comTelegram: https://t.me/mukhammad1985"
Karen Danielyan,"Hello, my name is Karen! I'm a professional designer and corporate style creator developing brand-books and new brands as well as re-branding and re-styling the working trademarks. Over the last 5 years, I have been working in mobile application and web world.Привет, я Карен! Я дизайнер профессионально занимающийся созданием логотипов, фирменного стиля, разработкой брендбуков для новых брендов, а также ребрендингом и&#8230; <span class='variable-text-link fake-link'> Read More</span></div><div class='variable-text variable-text-full hide'>Hello, my name is Karen! I'm a professional designer and corporate style creator developing brand-books and new brands as well as re-branding and re-styling the working trademarks. Over the last 5 years, I have been working in mobile application and web world.Привет, я Карен! Я дизайнер профессионально занимающийся созданием логотипов, фирменного стиля, разработкой брендбуков для новых брендов, а также ребрендингом и рестайлингом уже работающих брендов.Последние 5 лет я также плотно погружён в мир мобильных приложений и веб-дизайна. <span class='variable-text-link fake-link'> Read Less</span></div>"
Julia NK (Neroda) Designer,"Hello, my name is Julia! I am a Web and Mobile Designer , Graphic Designer. I help people create in creating modern designs. Open to new projects and looking forward to seeing how I can help you! I have a strong emphasis on the user interface:My final results:- Project and market analysis;- Sketches;- Frame &#8230; <span class='variable-text-link fake-link'> Read More</span></div><div class='variable-text variable-text-full hide'>Hello, my name is Julia! I am a Web and Mobile Designer , Graphic Designer. I help people create in creating modern designs. Open to new projects and looking forward to seeing how I can help you! I have a strong emphasis on the user interface:My final results:- Project and market analysis;- Sketches;- Frame binding;- UI / UX design;- Mobile application design;- Interactive prototypes- Tools for redesign: Design and prototyping: - Figma - Adobe Photoshop- Adobe Illustrator <span class='variable-text-link fake-link'> Read Less</span></div>"
Denis Stekhin,"Hello, my name is Denis Stekhin I'm UI/UX Designer from Kharkiv, Ukraine. And I work worldwide.My specialization is:➔ UI/UX Design➔ Product Design➔ Visual Design➔ Graphic Design➔ Branding"
Daria Zobnina,"Hello, my name is Daria.I’m a UI/UX Designer currently based in Leipzig. With a background in Economics, I know what businesses need and help to achieve their targets by turning their ideas into great and useful products."
Anastasiia Samsonova,"Hello, my name is Anastasiia Samsonova. I`m 23 years old.I'm UI/UX Designer. I'm open to your suggestions and cooperation. If you have any project, feel free to contact me:Email: Nastya.korchynska@gmail.comTelegram: @Anastasiia_K_23"
Alevtina Ksenofontova,"Hello, my name is Alevtina and I`m UX UI designer. I am developing design for websites and mobile applications.I am always ready for new projects and collaborations."
Ronald Gijezen,"Hello, I’m Ronald Gijezen, a Digital Designer currently living and working in the Netherlands.  www.exoape.comhello@exoape.com"
Kate 🐼 Akanemiko,"Hello, I'm Kate!I have more than 7 years of experience in UX/UI design, mobile interfaces design,web application, UI animation, motion video design!Focused on user experience.Passionate about my profession.Inspired to make UI better!Learning new things has always been a great motivator for me.Believe me, &#8230; <span class='variable-text-link fake-link'> Read More</span></div><div class='variable-text variable-text-full hide'>Hello, I'm Kate!I have more than 7 years of experience in UX/UI design, mobile interfaces design,web application, UI animation, motion video design!Focused on user experience.Passionate about my profession.Inspired to make UI better!Learning new things has always been a great motivator for me.Believe me, any design might be better in the right hands! <span class='variable-text-link fake-link'> Read Less</span></div>"
Eduardo Garcia,"Hello, I'm Eduardo Garcia, UX/UI Designer from Brazil. Get in touch at garcia.eduardo.br@gmail.com."
Anastasiia Starik,"Hello, I'm Anastasiia, graphic designer based in Ukraine.Specialising in branding, graphic design, print making, infographic and illustrationLet’s work together!"
Sara Amrousy,"Hello, I am Sara Egyptian Girl, I start working as UI Developer in November 2014, In my work, I was responsible for creating the website from A to Z starting from UI / UX, development (using WordPress), edits, etc. till the final product reach the end-user.Then I found I am enjoying UX/UI Design most so I decided&#8230; <span class='variable-text-link fake-link'> Read More</span></div><div class='variable-text variable-text-full hide'>Hello, I am Sara Egyptian Girl, I start working as UI Developer in November 2014, In my work, I was responsible for creating the website from A to Z starting from UI / UX, development (using WordPress), edits, etc. till the final product reach the end-user.Then I found I am enjoying UX/UI Design most so I decided to specialize in UI/UX and follow my passion.I am looking forward to working in a creative environment that allows me to improve my skills faster and helps me show my true power as a Strong Independent Egyptian girl trying to build a successful career for herself. My biggest dream is to own one of the most important agencies in the software field in the middle east and maybe in the whole world who knows?!. Dream Big Believe in yourself and Work Hard to Make it Happen. <span class='variable-text-link fake-link'> Read Less</span></div>"
Rehan Ali ✪,"Hello, I am Rehan Ali, a freelance Brand Identity & Motion Designer based in Pakistan. With more than 3 years of experience in the design industry.SERVICES•Branding •Animation •Motion Graphics•Iconography •UI design•IllustrationFor work inquiries please contact meEmail: rehanalisoomro10000@gmail.&#8230; <span class='variable-text-link fake-link'> Read More</span></div><div class='variable-text variable-text-full hide'>Hello, I am Rehan Ali, a freelance Brand Identity & Motion Designer based in Pakistan. With more than 3 years of experience in the design industry.SERVICES•Branding •Animation •Motion Graphics•Iconography •UI design•IllustrationFor work inquiries please contact meEmail: rehanalisoomro10000@gmail.comTelegram: @rehanali10000 <span class='variable-text-link fake-link'> Read Less</span></div>"
Vector Tee Store,"Hello, I am an expert t-shirt and graphic designer. I do amazing things according to the needs of the customers. Customer satisfaction is my goal. You can contact me if you need any design. Thank you"
Michael POTEMKIN,"Hello, I am a versatile designer who specializes in creating beautiful yet functional websites and digital interfaces. I like to help clients achieve their goals and develop their brands. I work exceptionally hard to achieve results with the people I work with.My visual style, I adapt to the needs and visual tre&#8230; <span class='variable-text-link fake-link'> Read More</span></div><div class='variable-text variable-text-full hide'>Hello, I am a versatile designer who specializes in creating beautiful yet functional websites and digital interfaces. I like to help clients achieve their goals and develop their brands. I work exceptionally hard to achieve results with the people I work with.My visual style, I adapt to the needs and visual trends that the project deserves, I create various sites that stand out both for their personality and unique user experience, always focused on creating a wow effect, I have a lot to grow always, but I know who I am and where I'm going, so if you want, you can support me by following me! If you want me to do a project, please contact me! I am always ready to make new projects.- Open to new projects, just contact me. <span class='variable-text-link fake-link'> Read Less</span></div>"
Zuza Rawa,"hello, i am a decent person"
Kseniia Bazanova,"Hello,   I create websites that help companies grow sales of their products and services. I achieve this by combining esthetic and memorable design with a functional user-friendly interface.  Feel welcome to share your ideas with me. Let's have a chat!bazanova.illustrator@gmail.com"
Luminous Design,"Hello we are Luminous Design Group, an Athens based storytelling studio. Our design services include branding, identity, print and digital design, packaging design and creative direction. We focus on branding and design with purpose. Approaching every project with passion, producing expressive, bold and innovati&#8230; <span class='variable-text-link fake-link'> Read More</span></div><div class='variable-text variable-text-full hide'>Hello we are Luminous Design Group, an Athens based storytelling studio. Our design services include branding, identity, print and digital design, packaging design and creative direction. We focus on branding and design with purpose. Approaching every project with passion, producing expressive, bold and innovative communication.We help brands empower their vision through meaningful design solutions._See more, do more <span class='variable-text-link fake-link'> Read Less</span></div>"
Egor Popov,"Hello there. Happy to get your attention. I'm very creative, inspiring and highly educated professional Web and Graphic designer. I am having 5 years experienced of web sites / mobile app / graphic design / printed products / etc. 📄 Email : offers.popov@gmail.com"
Farhad Ahmed,"Hello there!My name is Farhad Ahmed. Junior, Product Designer. I've been working with Product Design & Web Development for several years. See you my website down below. I'm a User Experience Designer specializing in Shopping (E-Commerce), Communication, News & Online Magazines, Health & Fitness, Medical, Travel,&#8230; <span class='variable-text-link fake-link'> Read More</span></div><div class='variable-text variable-text-full hide'>Hello there!My name is Farhad Ahmed. Junior, Product Designer. I've been working with Product Design & Web Development for several years. See you my website down below. I'm a User Experience Designer specializing in Shopping (E-Commerce), Communication, News & Online Magazines, Health & Fitness, Medical, Travel, Beauty, and Lifestyle, etc. apps & websites Design. I am capable of a wide range of tactical and big-picture design tasks. If you still don't have a clear idea of what you want, I can help you expand your idea so it meets your business and needs.I am basically an application designer (mobile and desktop) and I also work on website design and landing pages (Responsive Website Design). It's important to me to build long-term relationships with clients. My client’s satisfaction is what motivates me most in my work. If you need high-quality design and a responsible approach to work, you're in the right place! I'll make your design honestly & try my best.Thank You. <span class='variable-text-link fake-link'> Read Less</span></div>"
Vratislav Pecka,Hello there! My name is Vrati. I am a digital artist from Prague. I make posters most of the time.
Artur Dziuła,Hello there! I'm UI/UX & Webdesigner from Poland. Feel free and contact me!
Pavel Kramarenko,"Hello there,I'm professional Designer and Marketer. My passion is providing successful working solutions for my clients. My goal is to solve a problem you've faced and to help your business to soar. How do I actually work?Design and Marketing are my fields of expertize. I love to create outstanding designs, th&#8230; <span class='variable-text-link fake-link'> Read More</span></div><div class='variable-text variable-text-full hide'>Hello there,I'm professional Designer and Marketer. My passion is providing successful working solutions for my clients. My goal is to solve a problem you've faced and to help your business to soar. How do I actually work?Design and Marketing are my fields of expertize. I love to create outstanding designs, think through every detail and then watch how your bussiness flourishes. This is the way to create an amazing working product than will bring you money and joy throughout the years.One more thing about my philosophy: I believe that design is called to solve peoples' problems rather than cause new ones. That is why I provide complex services. What I said above means if you work with me there's no need to hire somebody else. (Of course I mean Design and Marketing) For example you need to create a stylish Logo - I'll do that. You also need Corporate Identity - I'll also design nice and professional branding for your company. Website - with great pleasure, Catalogue/magazine/brochure - no problem! Do not know where and how to print? - You'll get my recomendations. <span class='variable-text-link fake-link'> Read Less</span></div>"
Aleksandr Koshitskiy,"Hello my name is Sasha.I work worldwide, you can commission me at skype: Crystal-c9mail: sashacrystal09@gmail.comtelegramm: @SashaCrystal"
Md Nurunnabi Islam,"Hello guys,I'm Nurunnabi, and creating high-quality UI/UX Design is my passion. I will try my best to provide inspiration for your work. Thanking you for following,Here are My Details :- Expert at User Interface Design- Have very good knowledge about User Experience Design- Have many products in different&#8230; <span class='variable-text-link fake-link'> Read More</span></div><div class='variable-text variable-text-full hide'>Hello guys,I'm Nurunnabi, and creating high-quality UI/UX Design is my passion. I will try my best to provide inspiration for your work. Thanking you for following,Here are My Details :- Expert at User Interface Design- Have very good knowledge about User Experience Design- Have many products in different marketplace like Envato.- Have good communication skills with clients- very good knowledge of client satisfaction- Have very good concept about HTML5, CSS3- Excellent ability of leadership and creativity- Have quick learning power that can adopt any skills easily CONTACT WITH ME:Skype: live:nurunnabiislam75Mail: designernurunnabi@gmail.comWhat's app: +8801750553847 <span class='variable-text-link fake-link'> Read Less</span></div>"
Caroline Blanchet,Hello ! I'm a graphic designer based in France.I'm a designer who has a love for creativity and enjoys experimenting with various techniques. My work is mainly inspired by sport and culture. Feel free to contact me if you’re interested to hire me or just to say hello!
Vinay Gowtham M,"Hello - I'm Vinay Gowtham M, Freelance - Graphic Designer, illustrator, and Artist Based in Bangalore, India. I'm Specialize in Logo design, Branding & identity design, Packaging design, and illustration.Please feel free to contact me regarding inquiries, freelance projects or just to say Hi...Thanks!"
Ilya Raschupkin,"Head of HeyPixel Startup Studio, interface designer. Create over 30+ startups.If you want to hire me or my team write me at ilya@heypixel.ru"
Izvorka Juric,"Having obtained a degree at the School of Design at the Faculty of Architecture of the University of Zagreb, co-founded TRIDVAJEDAN creative agency with two partners. Ever since, worked as a managing partner and designer, art director, and creative and art director. Since 2011 has worked independently on various p&#8230; <span class='variable-text-link fake-link'> Read More</span></div><div class='variable-text variable-text-full hide'>Having obtained a degree at the School of Design at the Faculty of Architecture of the University of Zagreb, co-founded TRIDVAJEDAN creative agency with two partners. Ever since, worked as a managing partner and designer, art director, and creative and art director. Since 2011 has worked independently on various projects related to design and design education and collaborated intensively with small and medium enterprises, helping them develop their products for the Croatian and global markets.20+ years of experience with various visual communication projects, design projects, and design education projects. Won numerous professional awards and recognitions.Years of experience in lecturing and conducting professional workshops. Mentored various groups, including educational projects for elementary schools, training for future designers and design students, training in design and product development for professionals from various fields and businessmen. TED x speaker. <span class='variable-text-link fake-link'> Read Less</span></div>"
Hardy Branding,"Hardy Branding is a design studio based in Russia, working worldwide to design iconic brands and digital experiences with focus on elegant style and luxury appearance. We are partnering with handpicked selection of global brands and provide our clients, whether large or small, with a full array of branding service&#8230; <span class='variable-text-link fake-link'> Read More</span></div><div class='variable-text variable-text-full hide'>Hardy Branding is a design studio based in Russia, working worldwide to design iconic brands and digital experiences with focus on elegant style and luxury appearance. We are partnering with handpicked selection of global brands and provide our clients, whether large or small, with a full array of branding services as well as website design and development.______Hardy Branding – дизайн-студия, базирующаяся в России и работающая по всему миру над созданием узнаваемых элегантных и роскошных брендов и digital решений.  Мы сотрудничаем с мировыми брендами и предоставляем нашим клиентам, как большим корпорациям так и малому бизнесу полный спектр услуг по брендингу, а также дизайн и разработку веб-сайтов. <span class='variable-text-link fake-link'> Read Less</span></div>"
Hakan Ertan,"Hakan Ertan is an award-winning art director who has spent more than a decade at network agencies such as Saatchi & Saatchi, TBWA, GREY and BBDO. I have worked for brands such as Mercedes-Benz, Coca-Cola, BMW, Unicef, Frito Lay, and Adidas. Originally from Turkey, I received a BA in Graphic Design from Akademi Ist&#8230; <span class='variable-text-link fake-link'> Read More</span></div><div class='variable-text variable-text-full hide'>Hakan Ertan is an award-winning art director who has spent more than a decade at network agencies such as Saatchi & Saatchi, TBWA, GREY and BBDO. I have worked for brands such as Mercedes-Benz, Coca-Cola, BMW, Unicef, Frito Lay, and Adidas. Originally from Turkey, I received a BA in Graphic Design from Akademi Istanbul.  I'm currently working as a visual designer and is based out of Brooklyn, New York.Please have a look at my portfolio and feel free to contact me if you are interested. <span class='variable-text-link fake-link'> Read Less</span></div>"
Julia Danilets,"Greetings to all who entered my profile. I am an Illustrator and web designer. I am glad to present my works to you.I work worldwide, you can charge me a order through email: DaniletcART@yandex.ruПриветствую всех, кто зашел в мой профиль&#8230; <span class='variable-text-link fake-link'> Read More</span></div><div class='variable-text variable-text-full hide'>Greetings to all who entered my profile. I am an Illustrator and web designer. I am glad to present my works to you.I work worldwide, you can charge me a order through email: DaniletcART@yandex.ruПриветствую всех, кто зашел в мой профиль. Я иллюстратор и веб-дизайнер. Рада представить вам свои работы.Я работаю по всему миру, можете поручить мне заказ через email: DaniletcART@yandex.ru <span class='variable-text-link fake-link'> Read Less</span></div>"
Sandrin Design ⚡,"Graphic Designer, Social Media, Filmmaker, Photographer "
Yana Kravchenko,"Graphic designer, Illustrator & Vector Artist. Feel free to contact me at: yanapryhodko20@gmail.com"
Antonay ®,Graphic Designer IllustratorIG:  @_antonay
Sasha Kurilenko,"Graphic designer from Saint Petersburg, Russian Federation. Focused on brand identity and packaging. Perfectionist, rationalist, designer.👋🏻 kurilenkosashaa@gmail.com"
Clara Tadini,"Graphic designer based in London, graduated from FADU, University of Buenos Aires. Specialized in Brand Design and Visual Identity, Editorial Design, Photography and Creative Direction.Private portfolio upon request. Feel free to contact me! "
Andrey Rybin,"Graphic Designer and Illustrator based in Saint-Petersburg, Russia.I'm available for commission work: an.rybin@mail.ru"
Kseniya Glatkova,Graphic designer and Illustrator
Marko Marinković,"Graphic Designer and Artist. Inspired by nature, inner self and invisible world."
Constantine Ti,graphic designer - Lettering artistHello! If you have any questions or an interesting project write to me tihontut@gmail.com
atipo ®,"graphic design studio and foundry founded by raúl garcía del pomar and ismael gonzález: graphic communication, editorial design, corporate identity, web, motion, typography and illustration.info@atipo.es_______estudio gráfico y fudición fundado por raúl garcía del pomar e ismael gonzález: comunicación gráfic&#8230; <span class='variable-text-link fake-link'> Read More</span></div><div class='variable-text variable-text-full hide'>graphic design studio and foundry founded by raúl garcía del pomar and ismael gonzález: graphic communication, editorial design, corporate identity, web, motion, typography and illustration.info@atipo.es_______estudio gráfico y fudición fundado por raúl garcía del pomar e ismael gonzález: comunicación gráfica, diseño editorial, identidad corporativa, web, motion, tipografía e ilustración.info@atipo.es <span class='variable-text-link fake-link'> Read Less</span></div>"
Bernardo Henning,Graphic Artist / Co-founder at Bosque Studio.
