USERNAME,ABOUT
Ekaterina Klimanova,"I create aesthetic design with clear composition. I can capture the DNA of your brand and create a unique design for e-commerce, also I make design of landing pages.I am creative, open minded, sociable, can speak English.Love to travel around the world. Art and nature are major sources of inspiration for me. &#8230; <span class='variable-text-link fake-link'> Read More</span></div><div class='variable-text variable-text-full hide'>I create aesthetic design with clear composition. I can capture the DNA of your brand and create a unique design for e-commerce, also I make design of landing pages.I am creative, open minded, sociable, can speak English.Love to travel around the world. Art and nature are major sources of inspiration for me.  Please send me a message if you wanna work with me on your project. I will send you details. Thank you for your time.  <span class='variable-text-link fake-link'> Read Less</span></div>"
Jason Little,"I co-founded For The People in 2014, with the belief that creative businesses need to rethink how they operate, in order to put people at the heart of who they are and what they do. Through a strong focus on game-changing work and developing a thriving culture, everyone benefits - clients and staff alike.I've sp&#8230; <span class='variable-text-link fake-link'> Read More</span></div><div class='variable-text variable-text-full hide'>I co-founded For The People in 2014, with the belief that creative businesses need to rethink how they operate, in order to put people at the heart of who they are and what they do. Through a strong focus on game-changing work and developing a thriving culture, everyone benefits - clients and staff alike.I've spent the last several years running agencies as creative director in Sydney and Paris (Re, Landor Associates). I'm currently working out how to build an agency from scratch, and is also documenting the process in a podcast www.bythepeople.agency I'm also Chairman of AGDA in New South Wales (The Australian Graphic Design Association), with a focus on shaking things up and making it more exciting and relevant.I have plenty of experience on large-scale transformations, with previous work including the the branding of City of Melbourne, Optus, Seat, One Degree, Sydney Pavilion/Shanghai Biennale, and the Australian Cancer Research Foundation. My work has received nearly every kind of creative award and has been in exhibitions throughout the world. I also writes a fair bit, and takes part in Award Juries, most recently as Chairman for Design at AWARD. <span class='variable-text-link fake-link'> Read Less</span></div>"
Manoj Sharma,"I am Web and User Interface expert specialize in web user interface design,  I have around 3yrs. of experience in web designing and Front End User Interface development. Design with strong knowledge of web standards."
Veronika Shveinova,"I am Veronika, a professional 🤓 UX/UI  designer  and  I am here to help  you!My background 🎓 may probably surprise you as I hold a Bachelor’s degree in Biotechnology, so you may ask why that drastic change?The answer is quite simple - during the studies I realised that the science field constrains my cravi&#8230; <span class='variable-text-link fake-link'> Read More</span></div><div class='variable-text variable-text-full hide'>I am Veronika, a professional 🤓 UX/UI  designer  and  I am here to help  you!My background 🎓 may probably surprise you as I hold a Bachelor’s degree in Biotechnology, so you may ask why that drastic change?The answer is quite simple - during the studies I realised that the science field constrains my craving for creativity, so I turned to something that can fulfil my desires, and you guessed it - it is web design ;)In case you are wondering about the tools I work with on the day-to-day basis:✔️ Figma✔️Adobe XD✔️Adobe Illustrator✔️Adobe Photoshop✔️Adobe After Effects✔️InDesign✔️ZeplinDon't hesitate to ✉️contact me if you need any help or consultation about new exceptional Landing page design or e-Commerce Website design concept or update/ redesign/refinements for your brand. <span class='variable-text-link fake-link'> Read Less</span></div>"
Darren Maen,"I am the CEO and co-founder of Efir Media, an independent award-winning boutique design agency. I am also a creative mind behind the brand that takes a significant part in designing your custom website and control every process that your project comes through. This personal approach helps me and my team to create &#8230; <span class='variable-text-link fake-link'> Read More</span></div><div class='variable-text variable-text-full hide'>I am the CEO and co-founder of Efir Media, an independent award-winning boutique design agency. I am also a creative mind behind the brand that takes a significant part in designing your custom website and control every process that your project comes through. This personal approach helps me and my team to create one of the best tailor-made products on the market and as a result helps to ramp up your business and achieve success.  A judge at CSS Design Awards <span class='variable-text-link fake-link'> Read Less</span></div>"
SMI RASEL,"I am SMI Rasel. Web, WordPress &WooCommerce/Shopify/ Email MarketingExpert & Dig/ Dropship & eCommerce Expert.As freelancer Completed 40+ Projects of 12country's 22 client's at various marketplacessince 2018.Former Top Rated Web Developer & Leadexpert @Upwork / People Per Hour.Writecontinuously great freel&#8230; <span class='variable-text-link fake-link'> Read More</span></div><div class='variable-text variable-text-full hide'>I am SMI Rasel. Web, WordPress &WooCommerce/Shopify/ Email MarketingExpert & Dig/ Dropship & eCommerce Expert.As freelancer Completed 40+ Projects of 12country's 22 client's at various marketplacessince 2018.Former Top Rated Web Developer & Leadexpert @Upwork / People Per Hour.Writecontinuously great freelancing/fiverr/upwork/web /wordpress/ lead blogs for thefollowers. <span class='variable-text-link fake-link'> Read Less</span></div>"
AKhil JOhn,I am seeking a company where I can use my experience and education to help the company meet and surpass its goals and want to be part of the success in an environment of growth and excellence
Vladimir Gruev,I am passionate about creating products with a strong visual identity. It helps bring the company to the next level and allows for higher user engagement.
Алексей Жижков,"I am here to help you by taking over the strategy, illustration design and development of your website so that you can focus on other areas of your business.I build premium, fully custom websites for high-end SMBs, both informational websites and eCommerce websites.Interested in working with me? Shoot me a mes&#8230; <span class='variable-text-link fake-link'> Read More</span></div><div class='variable-text variable-text-full hide'>I am here to help you by taking over the strategy, illustration design and development of your website so that you can focus on other areas of your business.I build premium, fully custom websites for high-end SMBs, both informational websites and eCommerce websites.Interested in working with me? Shoot me a message and let’s see if we are a good fit for each other. Looking forward to hearing from you about your idea! <span class='variable-text-link fake-link'> Read Less</span></div>"
Haseeb Rana,"I am Expert in Graphic & Web Designing, Animation, HTML, HTML5, CSS3 with ZERO cross browser/Platform Issue, JavaScript, JQuery, Image Optimization, Branding etc. which enables me to apply for your organization.I have Designed wide range of websites using HMTL5, XHTML, CSS3, including sites for start-up companie&#8230; <span class='variable-text-link fake-link'> Read More</span></div><div class='variable-text variable-text-full hide'>I am Expert in Graphic & Web Designing, Animation, HTML, HTML5, CSS3 with ZERO cross browser/Platform Issue, JavaScript, JQuery, Image Optimization, Branding etc. which enables me to apply for your organization.I have Designed wide range of websites using HMTL5, XHTML, CSS3, including sites for start-up companies and small businesses. I am seeking opportunities to build websites from the ground up for you or your business. <span class='variable-text-link fake-link'> Read Less</span></div>"
Kostia Dmitriev,"I am experienced UI/UX designer. I worked on projects from different industries. Such as medicine, fashion, retail, real estate, interior design, conferences and many others. I make projects of any sizes, from landing page to CRM and marketplaces. "
Design Stock,I am doing affiliate marketing here.No projects belongs to me. All credits goes to their original owners .
Mehul Varshney,"I am currently working as an Assistant System Engineer Trainee at Tata Consultancy Services.I am passionate about UI/UX Designing.  I love to solve problems.Skills:•UI designing•User Research Quantitative and Qualitative•User Persona, Userflow User stories User journey and Epic•Wireframing•Prototyping&#8230; <span class='variable-text-link fake-link'> Read More</span></div><div class='variable-text variable-text-full hide'>I am currently working as an Assistant System Engineer Trainee at Tata Consultancy Services.I am passionate about UI/UX Designing.  I love to solve problems.Skills:•UI designing•User Research Quantitative and Qualitative•User Persona, Userflow User stories User journey and Epic•Wireframing•Prototyping•Information Architecture(Navigation, sitemap, wireframing, cardsorting)•Web designing•App Designing•Responsive DesignI have a fair knowledge in:•Adobe XD•Figma•Adobe Photoshop•HTML5•CSS3I am also familiar with:•WordPress•Javascript <span class='variable-text-link fake-link'> Read Less</span></div>"
Arafat Tusher,I am Arafat. I am WordPress Developer . I am working at Sylhet IT Academy. I can convert any file. I can using Elementor Pro make a website
Karthik N S,"I am an extremely passionate and motivated UI UX Designer with 7+ years of Experience from Bangalore.  Adding creativity and Happiness to the world, while inspiring people to be more productive rather than just consumers and always motivated to learn new things on my way. ""Designing is not just a job. It's a lif&#8230; <span class='variable-text-link fake-link'> Read More</span></div><div class='variable-text variable-text-full hide'>I am an extremely passionate and motivated UI UX Designer with 7+ years of Experience from Bangalore.  Adding creativity and Happiness to the world, while inspiring people to be more productive rather than just consumers and always motivated to learn new things on my way. ""Designing is not just a job. It's a lifestyle. It's all I am, all I have"" <span class='variable-text-link fake-link'> Read Less</span></div>"
Valentyna Sulima,"I am an enthusiastic and dedicated UI/UX designer with over 6 years of experience. Solving problems and creating new visual languages are my biggest passion. To me, great design is practical and starts with breaking things down into their simplest form. I am focused on product development not just on creating beau&#8230; <span class='variable-text-link fake-link'> Read More</span></div><div class='variable-text variable-text-full hide'>I am an enthusiastic and dedicated UI/UX designer with over 6 years of experience. Solving problems and creating new visual languages are my biggest passion. To me, great design is practical and starts with breaking things down into their simplest form. I am focused on product development not just on creating beautiful images. <span class='variable-text-link fake-link'> Read Less</span></div>"
Elina Chanieva,I am always interested and looking for new projects. Drop me a line on bionocopy@gmail.com
Ana Dovnar,I am a website designer.The current level allows me to lead UX/UI digital projects through  the whole pipeline from the conception to release. • landing pages • adaptive/responsive design • E-commercial stores
Oleksandr Mygal,"I am a UX/UI designer. My responsibility and passion for making things clear and useful for people, to help them solve issues without struggling against interface elements. I believe in analytics and data, prefer statistics to subjective judgments and have a solid technical background."
Nuriia Akhmetova,"I am a UX/UI designer with a year of experience, skilled in user experience design, UX research, creating a user-friendly interface. Redesigned the website for a yoga studio, which resulted in more clients and a higher conversion rate for the site by creating a user-oriented design. Completed several projects, inc&#8230; <span class='variable-text-link fake-link'> Read More</span></div><div class='variable-text variable-text-full hide'>I am a UX/UI designer with a year of experience, skilled in user experience design, UX research, creating a user-friendly interface. Redesigned the website for a yoga studio, which resulted in more clients and a higher conversion rate for the site by creating a user-oriented design. Completed several projects, including an e-commerce website that was finished 10% before target.  <span class='variable-text-link fake-link'> Read Less</span></div>"
Raf Terakyan,"I am a UX/UI designer experienced in diverse fields. I have helped many startups and businesses to get rid of confusing, hard-to-use interactions and interfaces by finding the best solutions to their issues. I have in-depth knowledge about almost all top designing software including the following: Sketch, Adobe Ph&#8230; <span class='variable-text-link fake-link'> Read More</span></div><div class='variable-text variable-text-full hide'>I am a UX/UI designer experienced in diverse fields. I have helped many startups and businesses to get rid of confusing, hard-to-use interactions and interfaces by finding the best solutions to their issues. I have in-depth knowledge about almost all top designing software including the following: Sketch, Adobe Photoshop, Adobe XD, Adobe Illustrator, Adobe Indesign, Adobe Acrobat, CorelDraw. It’s about making things that make sense.My skills:•	ux/ui design•	webpage design•	mobile applications design•	graphic design•	corporate design (brand logo/label/letters etc.)Why to choose me•	unique and creative design solutions•	detail oriented •	strong problem solving skills•	strong time management•	deadline oriented <span class='variable-text-link fake-link'> Read Less</span></div>"
Alyona Kliuchka,"I am a UX / UI Designer experienced in working with a range of tools including Figma, Sketch, Miro, Maze and ProtoPie. Such skills allow me to work both in group and individually. I am open to new job opportunities where I will be able to apply all my knowledge and improve my design skills. My goal is to grow pr&#8230; <span class='variable-text-link fake-link'> Read More</span></div><div class='variable-text variable-text-full hide'>I am a UX / UI Designer experienced in working with a range of tools including Figma, Sketch, Miro, Maze and ProtoPie. Such skills allow me to work both in group and individually. I am open to new job opportunities where I will be able to apply all my knowledge and improve my design skills. My goal is to grow professionally within the company, to bring it successful solutions and meet customers needs.  <span class='variable-text-link fake-link'> Read Less</span></div>"
Anastasia Yevtukhova,"I am a Ul/UX designer with modern look and responsible approach to my work. My main goal is not only to create beautiful and clean interfaces, but also to analyze the target audience, predict the user's thinking and then make the design as user-friendly as possible."
Helen Odintsova,"I am a UI / UX and Graphic designer,I also manage SMM and SMO.I focus on design for IT, online services, b2b / b2c projects. I am currently working as a freelancer, both on permanent and one-time projects of various difficulty levels.My goal as a designer is to develop intuitive, user-friendly, and understand&#8230; <span class='variable-text-link fake-link'> Read More</span></div><div class='variable-text variable-text-full hide'>I am a UI / UX and Graphic designer,I also manage SMM and SMO.I focus on design for IT, online services, b2b / b2c projects. I am currently working as a freelancer, both on permanent and one-time projects of various difficulty levels.My goal as a designer is to develop intuitive, user-friendly, and understandable design solutions for their further implementation and improving business performance.And the goal as an applicant is to find new interesting projects and a creative team with which you can work in tandem, share experience, and implement even more complex tasks.  <span class='variable-text-link fake-link'> Read Less</span></div>"
Teresa Chylińska-Kur,"I am a owner of KurkaStudio, small and ambitious graphic studio from Poland. We design visual identity, web design and develop our project, focusing on every detail."
Diogo Rosa,"I am a multidisciplinary designer, my main field of focus is branding and identity. Currently experimenting with 2D and 3D animation. Feel free to contact me for any collaboration, you can send me a private message or an email to diogo.asrosa@gmail.com."
Sergey Poluhin,"I am a multi-disciplinary designer with a rich work experience.Feel free to contact me!My professional interests are visual identity, packaging, typography, illustration. I am always interested in client projects and cooperation with colleagues and studios. And I'm also focused on help in matters of projects i&#8230; <span class='variable-text-link fake-link'> Read More</span></div><div class='variable-text variable-text-full hide'>I am a multi-disciplinary designer with a rich work experience.Feel free to contact me!My professional interests are visual identity, packaging, typography, illustration. I am always interested in client projects and cooperation with colleagues and studios. And I'm also focused on help in matters of projects implementation.Я мультидисциплинарный дизайнер с насыщенным опытом работы.Мои профессиональные интересы - это визуальная айдентика, упаковка, типографика, иллюстрация.Я всегда заинтересован в клиентских проектах и сотрудничестве с коллегами и студиями. А я также заинтересован в помощи в вопросах реализации проектов. <span class='variable-text-link fake-link'> Read Less</span></div>"
Chokun Choinw,"I am a junior Graphic designer , Motion designer . I was 18 years old . I like to work in the creativity area . I like to work in the minimal and modern styles because its simple but not simple 😁 . Contact me if you want collaboration .Contact me for commercial work ."
#NAME?,"I am a Hungarian graphic designer & artist. After Secondary School of Fine and Applied Arts, I graduated as a graphic designer.I create unique graphic works, paintings, drawings and graphic designs. I had 65 graphics exhibitions.With my drawings I travelled to abroad (Finland, Portugal, China, Bulgaria, Austr&#8230; <span class='variable-text-link fake-link'> Read More</span></div><div class='variable-text variable-text-full hide'>I am a Hungarian graphic designer & artist. After Secondary School of Fine and Applied Arts, I graduated as a graphic designer.I create unique graphic works, paintings, drawings and graphic designs. I had 65 graphics exhibitions.With my drawings I travelled to abroad (Finland, Portugal, China, Bulgaria, Austria, Transylvania, France, Ukraine).Email: battagraphics@gmail.com <span class='variable-text-link fake-link'> Read Less</span></div>"
Dmitriy Stokoz,"I am a high-level professional, have been working in UI/UX design for 4+ years. Since 2016 I've mainly focused on UI/UX design and had a partnership with a lot of startups, B2B/B2C companies and individual customers.My stack of skills and knowledge:🔹 UI/UX Design🔹 Interaction Design🔹 Research🔹 Wire-f&#8230; <span class='variable-text-link fake-link'> Read More</span></div><div class='variable-text variable-text-full hide'>I am a high-level professional, have been working in UI/UX design for 4+ years. Since 2016 I've mainly focused on UI/UX design and had a partnership with a lot of startups, B2B/B2C companies and individual customers.My stack of skills and knowledge:🔹 UI/UX Design🔹 Interaction Design🔹 Research🔹 Wire-framing/Prototyping🔹 UI Animations🔹 Graphic design🔹 MarketingTools:🔹 Sketch🔹 Figma🔹 Adobe Experience Design🔹 Adobe Photoshop🔹 Adobe Illustrator🔹 InVision🔹 PrincipleTrusting my expertise in UI/UX Design you will revolutionize your industry with the best solution and my team would be happy to become a part of your success story by achieving new standards and goals.I will provide my Dribbble/Behance profile to you during the interview so you can see my works.Have an idea? Talk to us! 📩 <span class='variable-text-link fake-link'> Read Less</span></div>"
Ann Malanicheva,"I am a graphic designer with a background in marketing and photography. I bring a positive attitude to every project. Whether it's business cards, a flyer, a poster, or a website, my unique combination of marketing know-how and design sense will give your next project a professional, polished look that will reflec&#8230; <span class='variable-text-link fake-link'> Read More</span></div><div class='variable-text variable-text-full hide'>I am a graphic designer with a background in marketing and photography. I bring a positive attitude to every project. Whether it's business cards, a flyer, a poster, or a website, my unique combination of marketing know-how and design sense will give your next project a professional, polished look that will reflect well on your audience. I love new and innovative solutions in design, I am glad to any comment. <span class='variable-text-link fake-link'> Read Less</span></div>"
Jurica Kos,"I am a graphic designer who is mainly focused on creating visual identities with a clear concept and strong character. Photography has always been my passion, and I like to use it in my work as much as I can."
Юрий Фокин,I am a freelance-designer. Specialize on landing pages. Open to new projects.
Вадим Чернышев,"I am a freelance-designer. Specialize on landing pages, e-commerce design templates and corporate site design. Open to new projects.For communication: pixlancer@ukr.net"
iykee Okonkwo,"I am a creative designer with experience in Corporate and Interface Design. I have outstanding collaborative interpersonal skills demonstrated through the successful completion of projects.I make use of tools such as Adobe Photoshop, Illustrator, Xd, and Figma to turn ideas into beautiful designs."
Elena Ru,"I am a brand designer, Perfectionist and aesthetic visual artist. I founded my own studio - LENARUD.esign.I will help you in the implementation of any design for your brand or project. I appreciate the significance, minimalism, aesthetics, conciseness and refinement in my works. At the moment, I have my own te&#8230; <span class='variable-text-link fake-link'> Read More</span></div><div class='variable-text variable-text-full hide'>I am a brand designer, Perfectionist and aesthetic visual artist. I founded my own studio - LENARUD.esign.I will help you in the implementation of any design for your brand or project. I appreciate the significance, minimalism, aesthetics, conciseness and refinement in my works. At the moment, I have my own team, with which we are creating:- Branding- Comprehensive corporate and visual identity- Logo Development- Instagram visual concept - Presentations, guides, packaging of information products- Website on Tilda <span class='variable-text-link fake-link'> Read Less</span></div>"
Elena Ru,"I am a brand designer, Perfectionist and aesthetic visual artist. I founded my own studio - LENARUD.esign.I will help you in the implementation of any design for your brand or project. I appreciate the significance, minimalism, aesthetics, conciseness and refinement in my works. At the moment, I have my own te&#8230; <span class='variable-text-link fake-link'> Read More</span></div><div class='variable-text variable-text-full hide'>I am a brand designer, Perfectionist and aesthetic visual artist. I founded my own studio - LENARUD.esign.I will help you in the implementation of any design for your brand or project. I appreciate the significance, minimalism, aesthetics, conciseness and refinement in my works. At the moment, I have my own team, with which we are creating:- Branding- Comprehensive corporate and visual identity- Logo Development- Instagram visual concept - Presentations, guides, packaging of information products- Website on Tilda <span class='variable-text-link fake-link'> Read Less</span></div>"
Huaman Studio,"Huaman is a visual communication studio focussed on Branding, Digital Design & Motion Graphics, based in Barcelona."
Huaman Studio,"Huaman is a visual communication studio focussed on Branding, Digital Design & Motion Graphics, based in Barcelona."
Alexander Ivanov,Hola 👋🏻My name is Alexander and I am an UX-UI Designer at Creative Mules!
Alexander Ivanov,Hola 👋🏻My name is Alexander and I am an UX-UI Designer at Creative Mules!
Hidden Characters,"Hidden Characters is the creative partnership of Dániel Nagy and Péter Orbán. The goal of our cooperation is to make personalized, innovative and first quality identity works in Hungary, and around the world."
